{
  "protocol_version": "measure/v1",
  "generated_at": "2026-08-14T00:00:00+00:00",
  "window": { "since": null, "until": null },
  "timezone": "UTC",
  "agent": ["claude", "codex"],
  "rates": {
    "catalog_version": "2026-07-29",
    "sha256": "5d86e11b3c953f03df6841ac5c48a4ac6a90701e60f24b42e814ce9ba47c25e9"
  },
  "session_ids": ["session-b"],
  "sessions": {
    "session-b": {
      "matched": true,
      "rows": [
        {
          "month": null,
          "agent": "claude",
          "model": "claude-opus-4-8",
          "token_kind": "cache_write_unknown",
          "tokens": 1000000,
          "priced_tokens": 1000000,
          "unpriced_tokens": 0,
          "estimated_cost_usd": 6.25,
          "credits": 0.0,
          "pricing_status": "lower_bound"
        },
        {
          "month": null,
          "agent": "claude",
          "model": "totally-unknown-model-xyz",
          "token_kind": "input_nocache",
          "tokens": 500,
          "priced_tokens": 0,
          "unpriced_tokens": 500,
          "estimated_cost_usd": 0.0,
          "credits": 0.0,
          "pricing_status": "unpriced"
        }
      ],
      "totals": {
        "tokens": 1000500,
        "priced_tokens": 1000000,
        "unpriced_tokens": 500,
        "estimated_cost_usd": 6.25,
        "credits": 0.0
      }
    }
  },
  "total": {
    "rows": [
      {
        "month": null,
        "agent": "claude",
        "model": "claude-opus-4-8",
        "token_kind": "cache_write_unknown",
        "tokens": 1000000,
        "priced_tokens": 1000000,
        "unpriced_tokens": 0,
        "estimated_cost_usd": 6.25,
        "credits": 0.0,
        "pricing_status": "lower_bound"
      },
      {
        "month": null,
        "agent": "claude",
        "model": "totally-unknown-model-xyz",
        "token_kind": "input_nocache",
        "tokens": 500,
        "priced_tokens": 0,
        "unpriced_tokens": 500,
        "estimated_cost_usd": 0.0,
        "credits": 0.0,
        "pricing_status": "unpriced"
      }
    ],
    "totals": {
      "tokens": 1000500,
      "priced_tokens": 1000000,
      "unpriced_tokens": 500,
      "estimated_cost_usd": 6.25,
      "credits": 0.0
    }
  },
  "data_quality": {
    "malformed_events": 0,
    "skipped_files": 0,
    "negative_deltas": 0,
    "unpriced_tokens": 500,
    "source_quality": { "ok": 2, "first_event_delta": 0 }
  }
}
